<?xml version="1.0" encoding="UTF-8"?>
<xs:schema xmlns:xs="http://www.w3.org/2001/XMLSchema">

    <xs:element name="pelicula">
        <xs:complexType>
            <xs:sequence>
                
                <xs:element name="titulo" type="xs:string"/>
                <xs:element name="director" type="xs:string"/>
                <xs:element name="sinopsis" type="xs:string"/>
                
                <xs:element name="actor" type="xs:string" maxOccurs="unbounded"/>
                
                <xs:element name="anio" type="xs:integer" minOccurs="0"/>
                
            </xs:sequence>
        </xs:complexType>
    </xs:element>

</xs:schema>