<?xml version="1.0" encoding="UTF-8"?>
<pelicula xmlns:xsi="http://www.w3.org/2001/XMLSchema-instance" xsi:noNamespaceSchemaLocation="pelicula.xsd">
    
    <titulo>El Señor de los Anillos: La Comunidad del Anillo</titulo>
    <director>Peter Jackson</director>
    <sinopsis>Un hobbit hereda un anillo que puede destruir el mundo.</sinopsis>
    
    <actor>Elijah Wood</actor>
    <actor>Ian McKellen</actor>
    <actor>Viggo Mortensen</actor>

    <anio>2001</anio>

</pelicula>